nombre,apellido,pref_con,pref_sin
Laura,Gómez,Ana Pérez; Marta Ruiz,Carlos López; Rubén Herrera
Javier,Pérez,Laura Gómez; Sergio Martínez,Ana Ruiz; Carlos López
Ana,Ruiz,Marta López; Laura Gómez,Javier Pérez; Rubén Herrera
Carlos,López,Javier Pérez,Ana Ruiz; Marta Ruiz
Marta,Ruiz,Ana González; Laura Gómez,Carlos López
Sergio,Martínez,Javier Pérez; Adrián Molina,Paula Ramírez; Carlos López
Lucía,Fernández,Laura Gómez; Paula Ramírez,Ana Ruiz
David,Sánchez,Sergio Martínez; Rubén Herrera,Marta Ruiz; Javier Pérez
Paula,Ramírez,Lucía Fernández,Claudia Suárez; Sergio Martínez
Rubén,Herrera,Paula Ramírez,Javier Pérez; Ana Ruiz; Marta Ruiz
Elena,Castro,Ana Ruiz; Nerea Ortega,Rubén Herrera
Adrián,Molina,Laura Gómez; Sergio Martínez,Paula Ramírez
Patricia,Navarro,Marta Ruiz,Claudia Suárez; Carlos López
Iván,Romero,Sergio Martínez,Javier Pérez; Ana Ruiz
Claudia,Suárez,Paula Ramírez,Irene Vega; Rubén Herrera
Óscar,Reyes,Dani Torres; Hugo Delgado,Patricia Navarro
Nerea,Ortega,Lucía Fernández,Elena Castro; Javier Pérez
Hugo,Delgado,Elena Castro,Irene Vega; Claudia Suárez
Irene,Vega,Claudia Suárez; Paula Ramírez,Hugo Delgado
Diego,Marín,Ana Ruiz; Marta Ruiz,Carlos López
